"user_id","status_id","created_at","screen_name","text","source","display_text_width","reply_to_status_id","reply_to_user_id","reply_to_screen_name","is_quote","is_retweet","favorite_count","retweet_count","quote_count","reply_count","hashtags","symbols","urls_url","urls_t.co","urls_expanded_url","media_url","media_t.co","media_expanded_url","media_type","ext_media_url","ext_media_t.co","ext_media_expanded_url","ext_media_type","mentions_user_id","mentions_screen_name","lang","quoted_status_id","quoted_text","quoted_created_at","quoted_source","quoted_favorite_count","quoted_retweet_count","quoted_user_id","quoted_screen_name","quoted_name","quoted_followers_count","quoted_friends_count","quoted_statuses_count","quoted_location","quoted_description","quoted_verified","retweet_status_id","retweet_text","retweet_created_at","retweet_source","retweet_favorite_count","retweet_retweet_count","retweet_user_id","retweet_screen_name","retweet_name","retweet_followers_count","retweet_friends_count","retweet_statuses_count","retweet_location","retweet_description","retweet_verified","place_url","place_name","place_full_name","place_type","country","country_code","geo_coords","coords_coords","bbox_coords","status_url","name","location","description","url","protected","followers_count","friends_count","listed_count","statuses_count","favourites_count","account_created_at","verified","profile_url","profile_expanded_url","account_lang","profile_banner_url","profile_background_url","profile_image_url"
"x67869827","x1331208690062528513",2020-11-24 12:10:59,"CzechGamer","Hellpoint - recenze [CzechGamer] https://t.co/sdKbu8MkQD","Twitter Web App",56,,,,FALSE,FALSE,0,0,,,,,"shar.es/aobHx8","https://t.co/sdKbu8MkQD","https://shar.es/aobHx8",,,,,,,,,,,"en",,,,,,,,,,,,,,,,,,,,,,,,,,,,,,,,,,,,,"NA NA","NA NA","NA NA NA NA NA NA NA NA","https://twitter.com/CzechGamer/status/1331208690062528513","CzechGamer.com","Česká republika","Patříme mezi nejstarší herní webové stránky s každodenním přísunem zábavy pro všechny věkové generace.","http://t.co/1QWFA6XLrd",FALSE,1023,1227,17,13946,237,2009-08-22 11:26:27,FALSE,"http://t.co/1QWFA6XLrd","http://www.czechgamer.com",,"https://pbs.twimg.com/profile_banners/67869827/1531401995","http://abs.twimg.com/images/themes/theme1/bg.png","http://pbs.twimg.com/profile_images/975815332534390784/SbSGyPWs_normal.jpg"
"x744224988539006976","x1331158491206197248",2020-11-24 08:51:30,"SpeedrunWRs","Hellpoint - Glitchless Any% [Current] in 28:08 by snakemuho: https://t.co/WDacsDeffg","WRBot",84,,,,FALSE,FALSE,1,0,,,,,"speedrun.com/hellpoint/run/…","https://t.co/WDacsDeffg","https://www.speedrun.com/hellpoint/run/z09n074z",,,,,,,,,,,"en",,,,,,,,,,,,,,,,,,,,,,,,,,,,,,,,,,,,,"NA NA","NA NA","NA NA NA NA NA NA NA NA","https://twitter.com/SpeedrunWRs/status/1331158491206197248","WRBot","The internet","Speedrun world records 24/7. Data based on @speedruncom. Created by @GyooRunsStuff. Support by making a donation : https://t.co/hoNKkjJ4P5",,FALSE,4999,0,22,144664,2,2016-06-18 17:47:19,FALSE,,,,,"http://abs.twimg.com/images/themes/theme1/bg.png","http://pbs.twimg.com/profile_images/977244590636961792/K3Jvljdf_normal.jpg"
"x715157511620263936","x1331141812103294976",2020-11-24 07:45:14,"gameplay_tips","#Hellpoint - How to Obtain Strangest Thing Achievement https://t.co/KYS2KCjxnM","Twitter Web App",78,,,,FALSE,FALSE,0,0,,,"Hellpoint",,"gameplay.tips/guides/8992-he…","https://t.co/KYS2KCjxnM","https://gameplay.tips/guides/8992-hellpoint.html",,,,,,,,,,,"en",,,,,,,,,,,,,,,,,,,,,,,,,,,,,,,,,,,,,"NA NA","NA NA","NA NA NA NA NA NA NA NA","https://twitter.com/gameplay_tips/status/1331141812103294976","Gameplay Tips","","Game Guides, Walkthroughs, Tips & Tricks, Cheats and more 🎮","https://t.co/PVLlTSwaY0",FALSE,153,79,1,9578,75,2016-03-30 12:43:32,FALSE,"https://t.co/PVLlTSwaY0","http://gameplay.tips",,"https://pbs.twimg.com/profile_banners/715157511620263936/1459342302","http://abs.twimg.com/images/themes/theme1/bg.png","http://pbs.twimg.com/profile_images/715158970361577472/cxvDBEE8_normal.jpg"
"x24463682","x1331095946524934146",2020-11-24 04:42:58,"AudaxDreik","true final boss of Hellpoint makes me want to rescind any recommendations for this game I may have given

1. start fight with only 2 heals
2. bad combos will kill you before you can even act occasionally
3. too big/complex, impossible to read when you're close enough to melee","Twitter Web App",276,,,,FALSE,FALSE,0,0,,,,,,,,,,,,,,,,,,"en",,,,,,,,,,,,,,,,,,,,,,,,,,,,,,,,,,,,,"NA NA","NA NA","NA NA NA NA NA NA NA NA","https://twitter.com/AudaxDreik/status/1331095946524934146","bold dragon 🦒🧣🍵","Seattle","crazy stupid and actively seeking to become more so. he/him/they","https://t.co/EXcGvh62cW",FALSE,103,214,3,3932,4353,2009-03-15 01:15:41,FALSE,"https://t.co/EXcGvh62cW","https://www.twitch.tv/audaxdreik",,,"http://abs.twimg.com/images/themes/theme13/bg.gif","http://pbs.twimg.com/profile_images/919746771605078017/cMhzFbMQ_normal.jpg"
"x24463682","x1329888172319207424",2020-11-20 20:43:43,"AudaxDreik","streaming more Hellpoint for a little while

https://t.co/h4cww0orZM","Twitter Web App",68,,,,FALSE,FALSE,0,0,,,,,"twitch.tv/audaxdreik","https://t.co/h4cww0orZM","https://www.twitch.tv/audaxdreik",,,,,,,,,,,"en",,,,,,,,,,,,,,,,,,,,,,,,,,,,,,,,,,,,,"NA NA","NA NA","NA NA NA NA NA NA NA NA","https://twitter.com/AudaxDreik/status/1329888172319207424","bold dragon 🦒🧣🍵","Seattle","crazy stupid and actively seeking to become more so. he/him/they","https://t.co/EXcGvh62cW",FALSE,103,214,3,3932,4353,2009-03-15 01:15:41,FALSE,"https://t.co/EXcGvh62cW","https://www.twitch.tv/audaxdreik",,,"http://abs.twimg.com/images/themes/theme13/bg.gif","http://pbs.twimg.com/profile_images/919746771605078017/cMhzFbMQ_normal.jpg"
"x24463682","x1330677017864413186",2020-11-23 00:58:18,"AudaxDreik","35 hours into Hellpoint, closing in on the end finally. it was a game

I enjoyed my time with it, but I'd have a hard time recommending it","Twitter for Android",138,,,,FALSE,FALSE,0,0,,,,,,,,,,,,,,,,,,"en",,,,,,,,,,,,,,,,,,,,,,,,,,,,,,,,,,,,,"NA NA","NA NA","NA NA NA NA NA NA NA NA","https://twitter.com/AudaxDreik/status/1330677017864413186","bold dragon 🦒🧣🍵","Seattle","crazy stupid and actively seeking to become more so. he/him/they","https://t.co/EXcGvh62cW",FALSE,103,214,3,3932,4353,2009-03-15 01:15:41,FALSE,"https://t.co/EXcGvh62cW","https://www.twitch.tv/audaxdreik",,,"http://abs.twimg.com/images/themes/theme13/bg.gif","http://pbs.twimg.com/profile_images/919746771605078017/cMhzFbMQ_normal.jpg"
"x24463682","x1329605189179830272",2020-11-20 01:59:14,"AudaxDreik","streaming Hellpoint for awhile. pretty good Soulslike meets Dead Space with some jank around the edges

https://t.co/h4cww0orZM","Twitter Web App",127,,,,FALSE,FALSE,0,0,,,,,"twitch.tv/audaxdreik","https://t.co/h4cww0orZM","https://www.twitch.tv/audaxdreik",,,,,,,,,,,"en",,,,,,,,,,,,,,,,,,,,,,,,,,,,,,,,,,,,,"NA NA","NA NA","NA NA NA NA NA NA NA NA","https://twitter.com/AudaxDreik/status/1329605189179830272","bold dragon 🦒🧣🍵","Seattle","crazy stupid and actively seeking to become more so. he/him/they","https://t.co/EXcGvh62cW",FALSE,103,214,3,3932,4353,2009-03-15 01:15:41,FALSE,"https://t.co/EXcGvh62cW","https://www.twitch.tv/audaxdreik",,,"http://abs.twimg.com/images/themes/theme13/bg.gif","http://pbs.twimg.com/profile_images/919746771605078017/cMhzFbMQ_normal.jpg"
"x1255981318719991808","x1331046067861938176",2020-11-24 01:24:46,"kelo262","Hellpoint is kicking my arsenic!  | Road to 400  #GalacticGaming | !dadjoke !workout !YouTube https://t.co/sN6w4jBTWD","Streamlabs Twitter",117,,,,FALSE,FALSE,0,0,,,"GalacticGaming",,"twitch.tv/kelo26","https://t.co/sN6w4jBTWD","https://twitch.tv/kelo26",,,,,,,,,,,"en",,,,,,,,,,,,,,,,,,,,,,,,,,,,,,,,,,,,,"NA NA","NA NA","NA NA NA NA NA NA NA NA","https://twitter.com/kelo262/status/1331046067861938176","kelo26","North America","I play a variety of games, nothing specific. I'm a casual gamer who enjoys long walks on the bea.... nvm. I like to play and have fun while doing that.","https://t.co/CMVigurEui",FALSE,70,83,1,156,122,2020-04-30 22:04:25,FALSE,"https://t.co/CMVigurEui","http://www.twitch.tv/kelo26",,,,"http://pbs.twimg.com/profile_images/1277349144986677248/NI9SyQiv_normal.jpg"
"x1255981318719991808","x1328866524321476608",2020-11-18 01:04:03,"kelo262","Hellpoint!   | Road to 400  #GalacticGaming | !dadjoke !workout !YouTube https://t.co/sN6w4jBTWD","Streamlabs Twitter",96,,,,FALSE,FALSE,0,0,,,"GalacticGaming",,"twitch.tv/kelo26","https://t.co/sN6w4jBTWD","https://twitch.tv/kelo26",,,,,,,,,,,"en",,,,,,,,,,,,,,,,,,,,,,,,,,,,,,,,,,,,,"NA NA","NA NA","NA NA NA NA NA NA NA NA","https://twitter.com/kelo262/status/1328866524321476608","kelo26","North America","I play a variety of games, nothing specific. I'm a casual gamer who enjoys long walks on the bea.... nvm. I like to play and have fun while doing that.","https://t.co/CMVigurEui",FALSE,70,83,1,156,122,2020-04-30 22:04:25,FALSE,"https://t.co/CMVigurEui","http://www.twitch.tv/kelo26",,,,"http://pbs.twimg.com/profile_images/1277349144986677248/NI9SyQiv_normal.jpg"
"x1255981318719991808","x1329898941916319747",2020-11-20 21:26:30,"kelo262","Starting with Nerm The Worm, then Hellpoint!   | Road to 400  #GalacticGaming | !dadjoke !workout !YouTube https://t.co/sN6w4jBTWD","Streamlabs Twitter",130,,,,FALSE,FALSE,0,0,,,"GalacticGaming",,"twitch.tv/kelo26","https://t.co/sN6w4jBTWD","https://twitch.tv/kelo26",,,,,,,,,,,"en",,,,,,,,,,,,,,,,,,,,,,,,,,,,,,,,,,,,,"NA NA","NA NA","NA NA NA NA NA NA NA NA","https://twitter.com/kelo262/status/1329898941916319747","kelo26","North America","I play a variety of games, nothing specific. I'm a casual gamer who enjoys long walks on the bea.... nvm. I like to play and have fun while doing that.","https://t.co/CMVigurEui",FALSE,70,83,1,156,122,2020-04-30 22:04:25,FALSE,"https://t.co/CMVigurEui","http://www.twitch.tv/kelo26",,,,"http://pbs.twimg.com/profile_images/1277349144986677248/NI9SyQiv_normal.jpg"
"x783149246178553856","x1330998210425466894",2020-11-23 22:14:36,"GamerGalsRT","Hellpoint https://t.co/0jrBwzuGLU @FameRTR @SGH_RTs @BlazedRTs @GamePromoters @LaZy_RTs @ShoutGamers @ShoutRTs #indiedev #GamersUnite #gamer #indiegame #Steam @GamerGalsRT @VideoGame_RTs @GamingRTweeters #gaming #game #videogame #PCGaming @tools_by_ezio #gamergirl #GamingNews","Galsrt help",140,,,,FALSE,TRUE,0,5,,,,,"zeepond.com/zeepond-review…","https://t.co/0jrBwzuGLU","https://www.zeepond.com/zeepond-reviews/hellpoint#.X7wwoGWycGM.twitter",,,,,,,,,"x3063885536 x717487503373107201 x962219190538199041 x715492170392846336 x3115159937 x702167731 x1345471728 x2949836039","The_CPT_FROGGY FameRTR SGH_RTs BlazedRTs GamePromoters LaZy_RTs ShoutGamers ShoutRTs","en",,,,,,,,,,,,,,,,"x1330994652384616448","Hellpoint https://t.co/0jrBwzuGLU @FameRTR @SGH_RTs @BlazedRTs @GamePromoters @LaZy_RTs @ShoutGamers @ShoutRTs #indiedev #GamersUnite #gamer #indiegame #Steam @GamerGalsRT @VideoGame_RTs @GamingRTweeters #gaming #game #videogame #PCGaming @tools_by_ezio #gamergirl #GamingNews",2020-11-23 22:00:28,"Twitter Web App",3,5,"x3063885536","The_CPT_FROGGY","The_CPT_FROGGY",1761,258,9212,"","Game enthusiast.Owner of ZeePond and founder of THE CPT FROGGY CLUB (group) on Steam.",FALSE,,,,,,,"NA NA","NA NA","NA NA NA NA NA NA NA NA","https://twitter.com/GamerGalsRT/status/1330998210425466894","⚔ GamerGals ⚔","","Creating a community supporting creators,streamers and game devs.
Follow and use @GamerGalsRT for retweet~  Main @KookyGalFi  if you want to talk ☺","https://t.co/twNbKNV2ao",FALSE,6664,2235,47,160097,205,2016-10-04 03:38:25,FALSE,"https://t.co/twNbKNV2ao","http://twitch.tv/KookyGal",,"https://pbs.twimg.com/profile_banners/783149246178553856/1491603442","http://abs.twimg.com/images/themes/theme1/bg.png","http://pbs.twimg.com/profile_images/785551388843577344/u7W2wC5s_normal.jpg"
"x764928929647955969","x1330995394340413440",2020-11-23 22:03:25,"GamingRTweeters","Hellpoint https://t.co/0jrBwzuGLU @FameRTR @SGH_RTs @BlazedRTs @GamePromoters @LaZy_RTs @ShoutGamers @ShoutRTs #indiedev #GamersUnite #gamer #indiegame #Steam @GamerGalsRT @VideoGame_RTs @GamingRTweeters #gaming #game #videogame #PCGaming @tools_by_ezio #gamergirl #GamingNews","Twitter Bot #1",140,,,,FALSE,TRUE,0,5,,,,,"zeepond.com/zeepond-review…","https://t.co/0jrBwzuGLU","https://www.zeepond.com/zeepond-reviews/hellpoint#.X7wwoGWycGM.twitter",,,,,,,,,"x3063885536 x717487503373107201 x962219190538199041 x715492170392846336 x3115159937 x702167731 x1345471728 x2949836039","The_CPT_FROGGY FameRTR SGH_RTs BlazedRTs GamePromoters LaZy_RTs ShoutGamers ShoutRTs","en",,,,,,,,,,,,,,,,"x1330994652384616448","Hellpoint https://t.co/0jrBwzuGLU @FameRTR @SGH_RTs @BlazedRTs @GamePromoters @LaZy_RTs @ShoutGamers @ShoutRTs #indiedev #GamersUnite #gamer #indiegame #Steam @GamerGalsRT @VideoGame_RTs @GamingRTweeters #gaming #game #videogame #PCGaming @tools_by_ezio #gamergirl #GamingNews",2020-11-23 22:00:28,"Twitter Web App",3,5,"x3063885536","The_CPT_FROGGY","The_CPT_FROGGY",1761,258,9212,"","Game enthusiast.Owner of ZeePond and founder of THE CPT FROGGY CLUB (group) on Steam.",FALSE,,,,,,,"NA NA","NA NA","NA NA NA NA NA NA NA NA","https://twitter.com/GamingRTweeters/status/1330995394340413440","Gaming RTs","","Gaming Retweets. Supporting Gamers Worldwide!
@ us for a retweet and Use the hashtag gamer
No follow needed ;)",,FALSE,7201,1,341,194752,18,2016-08-14 20:57:23,FALSE,,,,"https://pbs.twimg.com/profile_banners/764928929647955969/1585763032",,"http://pbs.twimg.com/profile_images/1245406538715594761/Qo_GUlnd_normal.jpg"
"x715492170392846336","x1330994807255281668",2020-11-23 22:01:05,"BlazedRTs","Hellpoint https://t.co/0jrBwzuGLU @FameRTR @SGH_RTs @BlazedRTs @GamePromoters @LaZy_RTs @ShoutGamers @ShoutRTs #indiedev #GamersUnite #gamer #indiegame #Steam @GamerGalsRT @VideoGame_RTs @GamingRTweeters #gaming #game #videogame #PCGaming @tools_by_ezio #gamergirl #GamingNews","BlazeRT",140,,,,FALSE,TRUE,0,5,,,,,"zeepond.com/zeepond-review…","https://t.co/0jrBwzuGLU","https://www.zeepond.com/zeepond-reviews/hellpoint#.X7wwoGWycGM.twitter",,,,,,,,,"x3063885536 x717487503373107201 x962219190538199041 x715492170392846336 x3115159937 x702167731 x1345471728 x2949836039","The_CPT_FROGGY FameRTR SGH_RTs BlazedRTs GamePromoters LaZy_RTs ShoutGamers ShoutRTs","en",,,,,,,,,,,,,,,,"x1330994652384616448","Hellpoint https://t.co/0jrBwzuGLU @FameRTR @SGH_RTs @BlazedRTs @GamePromoters @LaZy_RTs @ShoutGamers @ShoutRTs #indiedev #GamersUnite #gamer #indiegame #Steam @GamerGalsRT @VideoGame_RTs @GamingRTweeters #gaming #game #videogame #PCGaming @tools_by_ezio #gamergirl #GamingNews",2020-11-23 22:00:28,"Twitter Web App",3,5,"x3063885536","The_CPT_FROGGY","The_CPT_FROGGY",1761,258,9212,"","Game enthusiast.Owner of ZeePond and founder of THE CPT FROGGY CLUB (group) on Steam.",FALSE,,,,,,,"NA NA","NA NA","NA NA NA NA NA NA NA NA","https://twitter.com/BlazedRTs/status/1330994807255281668","Blazed","","@ us and we will RT your tweet instantly, must be following. get $10 in free bitcoin when you buy or sell $100 or more with the link below✨💙","https://t.co/T5ZPlASc7u",FALSE,23261,2,81,533834,24883,2016-03-31 10:53:21,FALSE,"https://t.co/T5ZPlASc7u","https://bit.ly/coinbaseXblazed",,"https://pbs.twimg.com/profile_banners/715492170392846336/1592304287","http://abs.twimg.com/images/themes/theme1/bg.png","http://pbs.twimg.com/profile_images/1272841762910994432/GtPZ_a2S_normal.jpg"
"x962219190538199041","x1330994803736195078",2020-11-23 22:01:04,"SGH_RTs","Hellpoint https://t.co/0jrBwzuGLU @FameRTR @SGH_RTs @BlazedRTs @GamePromoters @LaZy_RTs @ShoutGamers @ShoutRTs #indiedev #GamersUnite #gamer #indiegame #Steam @GamerGalsRT @VideoGame_RTs @GamingRTweeters #gaming #game #videogame #PCGaming @tools_by_ezio #gamergirl #GamingNews","SGHRetweeter2",140,,,,FALSE,TRUE,0,5,,,,,"zeepond.com/zeepond-review…","https://t.co/0jrBwzuGLU","https://www.zeepond.com/zeepond-reviews/hellpoint#.X7wwoGWycGM.twitter",,,,,,,,,"x3063885536 x717487503373107201 x962219190538199041 x715492170392846336 x3115159937 x702167731 x1345471728 x2949836039","The_CPT_FROGGY FameRTR SGH_RTs BlazedRTs GamePromoters LaZy_RTs ShoutGamers ShoutRTs","en",,,,,,,,,,,,,,,,"x1330994652384616448","Hellpoint https://t.co/0jrBwzuGLU @FameRTR @SGH_RTs @BlazedRTs @GamePromoters @LaZy_RTs @ShoutGamers @ShoutRTs #indiedev #GamersUnite #gamer #indiegame #Steam @GamerGalsRT @VideoGame_RTs @GamingRTweeters #gaming #game #videogame #PCGaming @tools_by_ezio #gamergirl #GamingNews",2020-11-23 22:00:28,"Twitter Web App",3,5,"x3063885536","The_CPT_FROGGY","The_CPT_FROGGY",1761,258,9212,"","Game enthusiast.Owner of ZeePond and founder of THE CPT FROGGY CLUB (group) on Steam.",FALSE,,,,,,,"NA NA","NA NA","NA NA NA NA NA NA NA NA","https://twitter.com/SGH_RTs/status/1330994803736195078","SocialGamingHub Retweets","Worldwide","We retweet everything you tag us in! Only rules are to follow us! Our main: @SocialGamingHub",,FALSE,44889,5981,85,1473917,188,2018-02-10 06:58:27,FALSE,,,,"https://pbs.twimg.com/profile_banners/962219190538199041/1518249092",,"http://pbs.twimg.com/profile_images/962232296915992576/5XQi36v-_normal.jpg"
"x3063885536","x1330994652384616448",2020-11-23 22:00:28,"The_CPT_FROGGY","Hellpoint https://t.co/0jrBwzuGLU @FameRTR @SGH_RTs @BlazedRTs @GamePromoters @LaZy_RTs @ShoutGamers @ShoutRTs #indiedev #GamersUnite #gamer #indiegame #Steam @GamerGalsRT @VideoGame_RTs @GamingRTweeters #gaming #game #videogame #PCGaming @tools_by_ezio #gamergirl #GamingNews","Twitter Web App",276,,,,FALSE,FALSE,3,5,,,"indiedev GamersUnite gamer indiegame Steam gaming game videogame PCGaming gamergirl GamingNews",,"zeepond.com/zeepond-review…","https://t.co/0jrBwzuGLU","https://www.zeepond.com/zeepond-reviews/hellpoint#.X7wwoGWycGM.twitter",,,,,,,,,"x717487503373107201 x962219190538199041 x715492170392846336 x3115159937 x702167731 x1345471728 x2949836039 x783149246178553856 x2409618734 x764928929647955969 x1273611219337912320","FameRTR SGH_RTs BlazedRTs GamePromoters LaZy_RTs ShoutGamers ShoutRTs GamerGalsRT VideoGame_RTs GamingRTweeters tools_by_ezio","en",,,,,,,,,,,,,,,,,,,,,,,,,,,,,,,,,,,,,"NA NA","NA NA","NA NA NA NA NA NA NA NA","https://twitter.com/The_CPT_FROGGY/status/1330994652384616448","The_CPT_FROGGY","","Game enthusiast.Owner of ZeePond and founder of THE CPT FROGGY CLUB (group) on Steam.","https://t.co/pmUlioWmuX",FALSE,1761,258,74,9212,485,2015-03-06 02:40:55,FALSE,"https://t.co/pmUlioWmuX","http://www.zeepond.com/",,"https://pbs.twimg.com/profile_banners/3063885536/1477054763","http://abs.twimg.com/images/themes/theme1/bg.png","http://pbs.twimg.com/profile_images/609594164439728128/CJWpT1N7_normal.jpg"
"x357787800","x1330966083709394945",2020-11-23 20:06:57,"AressAlmighty","When will we finish the game? I feel like we are close to the end but also don't so idk.
Playing: Hellpoint
https://t.co/bYNdOyc4Dq","TweetDeck",131,,,,FALSE,FALSE,0,0,,,,,"twitch.tv/aressalmighty","https://t.co/bYNdOyc4Dq","https://www.twitch.tv/aressalmighty",,,,,,,,,,,"en",,,,,,,,,,,,,,,,,,,,,,,,,,,,,,,,,,,,,"NA NA","NA NA","NA NA NA NA NA NA NA NA","https://twitter.com/AressAlmighty/status/1330966083709394945","Ares","Belgium","An upcoming Twitch streamer? Idk, you tell me
Love music. Especially hip-hop","https://t.co/Whbz8TCEyN",FALSE,69,105,2,1409,1198,2011-08-18 22:21:13,FALSE,"https://t.co/Whbz8TCEyN","http://twitch.tv/aressalmighty",,"https://pbs.twimg.com/profile_banners/357787800/1595565958","http://abs.twimg.com/images/themes/theme1/bg.png","http://pbs.twimg.com/profile_images/1197698385798729729/5PrTOOlV_normal.jpg"
"x357787800","x1329162571195305985",2020-11-18 20:40:26,"AressAlmighty","Taking a break from Black Ops and going back to Hellpoint for toodaey. A bit of co-op with my cousin.
https://t.co/bYNdOyc4Dq https://t.co/y95i4fZEt4","TweetDeck",125,,,,FALSE,FALSE,0,0,,,,,"twitch.tv/aressalmighty","https://t.co/bYNdOyc4Dq","https://www.twitch.tv/aressalmighty","http://pbs.twimg.com/ext_tw_video_thumb/1329162469122699276/pu/img/m5xKR7dENCrssGQt.jpg","https://t.co/y95i4fZEt4","https://twitter.com/AressAlmighty/status/1329162571195305985/video/1","photo","http://pbs.twimg.com/ext_tw_video_thumb/1329162469122699276/pu/img/m5xKR7dENCrssGQt.jpg","https://t.co/y95i4fZEt4","https://twitter.com/AressAlmighty/status/1329162571195305985/video/1",,,,"en",,,,,,,,,,,,,,,,,,,,,,,,,,,,,,,,,,,,,"NA NA","NA NA","NA NA NA NA NA NA NA NA","https://twitter.com/AressAlmighty/status/1329162571195305985","Ares","Belgium","An upcoming Twitch streamer? Idk, you tell me
Love music. Especially hip-hop","https://t.co/Whbz8TCEyN",FALSE,69,105,2,1409,1198,2011-08-18 22:21:13,FALSE,"https://t.co/Whbz8TCEyN","http://twitch.tv/aressalmighty",,"https://pbs.twimg.com/profile_banners/357787800/1595565958","http://abs.twimg.com/images/themes/theme1/bg.png","http://pbs.twimg.com/profile_images/1197698385798729729/5PrTOOlV_normal.jpg"
"x911170948908425216","x1330954641287344129",2020-11-23 19:21:29,"snaKemuho","finally got under 30min glitchless speedrun in 2020 GOTY Hellpoint
thanks for making a game i wasted months on lmao @CradleGames 
#videogame #twitch #hellpoint #cradlegames #speedrun #dont #tell @HellkiteRuns #im #stealing #hashtags #from #his #post
https://t.co/2uutLkEUQj","Twitter Web App",273,,,,FALSE,FALSE,4,0,,,"videogame twitch hellpoint cradlegames speedrun dont tell im stealing hashtags from his post",,"youtu.be/Sqd-gixTiYk","https://t.co/2uutLkEUQj","http://youtu.be/Sqd-gixTiYk",,,,,,,,,"x4874493841 x1301198749948170240","CradleGames HellkiteRuns","en",,,,,,,,,,,,,,,,,,,,,,,,,,,,,,,,,,,,,"NA NA","NA NA","NA NA NA NA NA NA NA NA","https://twitter.com/snaKemuho/status/1330954641287344129","Tez","","🤔",,FALSE,5,40,0,34,500,2017-09-22 10:10:57,FALSE,,,,"https://pbs.twimg.com/profile_banners/911170948908425216/1506075829","http://abs.twimg.com/images/themes/theme1/bg.png","http://pbs.twimg.com/profile_images/911173549456576512/g_I2e7NU_normal.jpg"
"x1231328606112157696","x1330953069417390080",2020-11-23 19:15:14,"TheIrishCarp","Huge shoutout to the kindest person in the community! Gifting me a Roxio capture card and an awesome @CradleGames #Hellpoint T-shirt!! @markjpwns https://t.co/cnQJS0u4ug","Twitter for iPhone",145,,,,FALSE,FALSE,5,0,,,"Hellpoint",,,,,"http://pbs.twimg.com/media/Enh-wuEXUAgzDg8.jpg","https://t.co/cnQJS0u4ug","https://twitter.com/TheIrishCarp/status/1330953069417390080/photo/1","photo","http://pbs.twimg.com/media/Enh-wuEXUAgzDg8.jpg","https://t.co/cnQJS0u4ug","https://twitter.com/TheIrishCarp/status/1330953069417390080/photo/1",,"x4874493841 x730266734695845888","CradleGames markjpwns","en",,,,,,,,,,,,,,,,,,,,,,,,,,,,,,,,,,,,,"NA NA","NA NA","NA NA NA NA NA NA NA NA","https://twitter.com/TheIrishCarp/status/1330953069417390080","KHARN","Toronto, Ontario","I build sets for tv shows. 🇮🇪 living in 🇨🇦 SeriesX/PS5/switch/ Pc. Comic collector. Owner and operator of Everything Xbox (32K followers) writer @GamerhubCo","https://t.co/CkmyH00zo9",FALSE,394,516,0,2892,6181,2020-02-22 21:23:18,FALSE,"https://t.co/CkmyH00zo9","https://m.facebook.com/EveryTh1ngXBOX/",,"https://pbs.twimg.com/profile_banners/1231328606112157696/1604038848",,"http://pbs.twimg.com/profile_images/1253141770831003648/z31x-4V7_normal.jpg"
"x861428821005713408","x1330932257385803776",2020-11-23 17:52:32,"Ajo1322","@zachurrate I love the souls like games! Have you ever tried hellpoint? That’s another good souls like game I’ve been playing 😄","Twitter for iPhone",115,"x1330931821035524103","x1260263579263160327","zachurrate",FALSE,FALSE,1,0,,,,,,,,,,,,,,,,"x1260263579263160327","zachurrate","en",,,,,,,,,,,,,,,,,,,,,,,,,,,,,,,,,,,,,"NA NA","NA NA","NA NA NA NA NA NA NA NA","https://twitter.com/Ajo1322/status/1330932257385803776","Alex ortiz","Reading, PA","An amateur streamer and blogger I’m always posting way too much on social media about all things gaming. Give me a follow and let’s talk about video games.","https://t.co/7gaqoGtAZv",FALSE,921,435,12,11520,31078,2017-05-08 03:53:30,FALSE,"https://t.co/7gaqoGtAZv","https://linktr.ee/Ajo132",,"https://pbs.twimg.com/profile_banners/861428821005713408/1598200987",,"http://pbs.twimg.com/profile_images/1156664308824195072/lLkWLd-9_normal.jpg"
"x943982708426002432","x1330499744980938752",2020-11-22 13:13:53,"proxWitch","I slept on this game.... Glad i woke up. Great souls-like. Will be streaming @CradleGames all week til we beat it.
Follow me on @Twitch (link in bio)
#TwitchAffilate #twitch #SupportSmallStreamers #hellpoint #gamers #gamergirl #PC #Xbox #RPG #arpg #follow #sub https://t.co/VgfEoYue6v","proxwitch",140,,,,FALSE,TRUE,0,3,,,,,,,,,,,,,,,,"x1168863187678257153 x4874493841","AmazinWest CradleGames","en",,,,,,,,,,,,,,,,"x1330495315225550848","I slept on this game.... Glad i woke up. Great souls-like. Will be streaming @CradleGames all week til we beat it.
Follow me on @Twitch (link in bio)
#TwitchAffilate #twitch #SupportSmallStreamers #hellpoint #gamers #gamergirl #PC #Xbox #RPG #arpg #follow #sub https://t.co/VgfEoYue6v",2020-11-22 12:56:17,"Twitter for Android",11,3,"x1168863187678257153","AmazinWest","amazin_west",139,234,502,"","OG Gamer from the NES days. I stream plenty of games on Mixer. Giveaways and funny moments are just a follow away. Small stream...Big dream. -AMAZIN31",FALSE,,,,,,,"NA NA","NA NA","NA NA NA NA NA NA NA NA","https://twitter.com/proxWitch/status/1330499744980938752","XAIDA","N/A ","I do stuff for @xaelserpent 
Please follow","https://t.co/nqbW2EeczV",FALSE,681,283,9,37858,47,2017-12-21 23:13:10,FALSE,"https://t.co/nqbW2EeczV","http://twitch.tv/xaelserpent",,"https://pbs.twimg.com/profile_banners/943982708426002432/1517761607","http://abs.twimg.com/images/themes/theme1/bg.png","http://pbs.twimg.com/profile_images/1307964241333420032/WILvswVj_normal.jpg"
