"x56061157","x1328135606694768640",2020-11-16 00:39:38,"angelus_04","Let's Play Hellpoint Co-op Part 8 - Artillery https://t.co/9SCxSaMnLO via @YouTube","Twitter Web App",82,,,,FALSE,FALSE,1,0,,,,,"youtu.be/BGzGMTN1hvA","https://t.co/9SCxSaMnLO","https://youtu.be/BGzGMTN1hvA",,,,,,,,,"x10228272","YouTube","en",,,,,,,,,,,,,,,,,,,,,,,,,,,,,,,,,,,,,"NA NA","NA NA","NA NA NA NA NA NA NA NA","https://twitter.com/angelus_04/status/1328135606694768640","Tom the Bad Hombre and supporter of Nasty Women 🌊","Garland,TX","Gamer, and lover of transsexuals looking to seriously date one proud member of #KhiveForBiden #TrumpYouAreFired #TrumpLost","https://t.co/cCuRy1A9np",FALSE,1225,5002,3,40332,66515,2009-07-12 09:55:31,FALSE,"https://t.co/cCuRy1A9np","https://www.youtube.com/user/childofthe80s1981",,"https://pbs.twimg.com/profile_banners/56061157/1527560128","http://abs.twimg.com/images/themes/theme1/bg.png","http://pbs.twimg.com/profile_images/1001285256744349696/fGbRJqBD_normal.jpg"
"x1934852689","x1328139020124254211",2020-11-16 00:53:12,"eviljosh94","It’s time to submit myself to being attacked by Ozys hands flicking Stones at me.
@Mark_286 
@CradleGames 
#Hellpoint https://t.co/1WrWOiPrr7","Twitter for iPhone",117,,,,FALSE,FALSE,2,0,,,"Hellpoint",,,,,"http://pbs.twimg.com/media/Em5_ZaqWMAI4htn.jpg","https://t.co/1WrWOiPrr7","https://twitter.com/eviljosh94/status/1328139020124254211/photo/1","photo","http://pbs.twimg.com/media/Em5_ZaqWMAI4htn.jpg","https://t.co/1WrWOiPrr7","https://twitter.com/eviljosh94/status/1328139020124254211/photo/1",,"x865186449091678208 x4874493841","Mark_286 CradleGames","en",,,,,,,,,,,,,,,,,,,,,,,,,,,,,,,,,,,,,"NA NA","NA NA","NA NA NA NA NA NA NA NA","https://twitter.com/eviljosh94/status/1328139020124254211","Very_Hazardous","Wales","Variety Streamer on Twitch 👀👀 Instagram is also Very_Hazardous. There’s always something being streamed so there’s something for everyone.","https://t.co/7nlOCaUcP6",FALSE,220,823,1,4335,5296,2013-10-04 16:54:43,FALSE,"https://t.co/7nlOCaUcP6","https://www.twitch.tv/very_hazardous",,"https://pbs.twimg.com/profile_banners/1934852689/1590741515","http://abs.twimg.com/images/themes/theme1/bg.png","http://pbs.twimg.com/profile_images/1228372000789422080/D_C1KosT_normal.jpg"
"x1168321710095052800","x1328034639865319425",2020-11-15 17:58:26,"MrReckless94","@anarchyKaos666 Hellpoint has a smaller team than that, and that game runs amazingly....I know it’s from a different genre but it proves that smaller teams can do great things","Twitter for iPhone",159,"x1328033860542746626","x1168321710095052800","MrReckless94",FALSE,FALSE,1,0,,,,,,,,,,,,,,,,"x716298808712245248","anarchyKaos666","en",,,,,,,,,,,,,,,,,,,,,,,,,,,,,,,,,,,,,"NA NA","NA NA","NA NA NA NA NA NA NA NA","https://twitter.com/MrReckless94/status/1328034639865319425","☠️MrReckless94☠️","Burnley, England","25- Anime is a way of life ^.^ Gamertag- MrReckless2470 Switch- 8004-3502-5148","https://t.co/bn5JRXARVN",FALSE,252,606,0,7874,16384,2019-09-02 00:36:26,FALSE,"https://t.co/bn5JRXARVN","http://mixer.com/mrreckless94",,"https://pbs.twimg.com/profile_banners/1168321710095052800/1605154062",,"http://pbs.twimg.com/profile_images/1322765830392860674/sIQiPRjq_normal.jpg"
