"user_id","status_id","created_at","screen_name","text","source","display_text_width","reply_to_status_id","reply_to_user_id","reply_to_screen_name","is_quote","is_retweet","favorite_count","retweet_count","quote_count","reply_count","hashtags","symbols","urls_url","urls_t.co","urls_expanded_url","media_url","media_t.co","media_expanded_url","media_type","ext_media_url","ext_media_t.co","ext_media_expanded_url","ext_media_type","mentions_user_id","mentions_screen_name","lang","quoted_status_id","quoted_text","quoted_created_at","quoted_source","quoted_favorite_count","quoted_retweet_count","quoted_user_id","quoted_screen_name","quoted_name","quoted_followers_count","quoted_friends_count","quoted_statuses_count","quoted_location","quoted_description","quoted_verified","retweet_status_id","retweet_text","retweet_created_at","retweet_source","retweet_favorite_count","retweet_retweet_count","retweet_user_id","retweet_screen_name","retweet_name","retweet_followers_count","retweet_friends_count","retweet_statuses_count","retweet_location","retweet_description","retweet_verified","place_url","place_name","place_full_name","place_type","country","country_code","geo_coords","coords_coords","bbox_coords","status_url","name","location","description","url","protected","followers_count","friends_count","listed_count","statuses_count","favourites_count","account_created_at","verified","profile_url","profile_expanded_url","account_lang","profile_banner_url","profile_background_url","profile_image_url"
"x3081538215","x1331145687048794117",2020-11-24 08:00:37,"TheVideoGamesUK","Werewolf: The Apocalypse - Earthblood (Xbox Series X) - https://t.co/Ee7MsseLs7 #thevideogames https://t.co/9mWU7KQrb8","The Video Games",94,,,,FALSE,FALSE,0,0,,,"thevideogames",,"thevideogames.co.uk/werewolf-the-a…","https://t.co/Ee7MsseLs7","https://www.thevideogames.co.uk/werewolf-the-apocalypse-earthblood-xbox-series-x-2/","http://pbs.twimg.com/media/Enkt8qzWEAEh6oM.jpg","https://t.co/9mWU7KQrb8","https://twitter.com/TheVideoGamesUK/status/1331145687048794117/photo/1","photo","http://pbs.twimg.com/media/Enkt8qzWEAEh6oM.jpg","https://t.co/9mWU7KQrb8","https://twitter.com/TheVideoGamesUK/status/1331145687048794117/photo/1",,,,"en",,,,,,,,,,,,,,,,,,,,,,,,,,,,,,,,,,,,,"NA NA","NA NA","NA NA NA NA NA NA NA NA","https://twitter.com/TheVideoGamesUK/status/1331145687048794117","The Video Games","United Kingdom","The Video Games Official Twitter account","https://t.co/cnfeso6uCz",FALSE,1206,522,19,32545,587,2015-03-09 13:28:02,FALSE,"https://t.co/cnfeso6uCz","http://www.thevideogames.co.uk",,"https://pbs.twimg.com/profile_banners/3081538215/1426176322","http://abs.twimg.com/images/themes/theme1/bg.png","http://pbs.twimg.com/profile_images/574924978941915136/KJSS7_v1_normal.jpeg"
"x3081538215","x1330956933008908289",2020-11-23 19:30:35,"TheVideoGamesUK","Werewolf: The Apocalypse - Earthblood (Xbox Series X) - https://t.co/HHQ4ajeYiy #thevideogames https://t.co/0cQrQcqoMd","The Video Games",94,,,,FALSE,FALSE,0,0,,,"thevideogames",,"thevideogames.co.uk/werewolf-the-a…","https://t.co/HHQ4ajeYiy","https://www.thevideogames.co.uk/werewolf-the-apocalypse-earthblood-xbox-series-x/","http://pbs.twimg.com/media/EniCRvuXMAEVIiP.jpg","https://t.co/0cQrQcqoMd","https://twitter.com/TheVideoGamesUK/status/1330956933008908289/photo/1","photo","http://pbs.twimg.com/media/EniCRvuXMAEVIiP.jpg","https://t.co/0cQrQcqoMd","https://twitter.com/TheVideoGamesUK/status/1330956933008908289/photo/1",,,,"en",,,,,,,,,,,,,,,,,,,,,,,,,,,,,,,,,,,,,"NA NA","NA NA","NA NA NA NA NA NA NA NA","https://twitter.com/TheVideoGamesUK/status/1330956933008908289","The Video Games","United Kingdom","The Video Games Official Twitter account","https://t.co/cnfeso6uCz",FALSE,1206,522,19,32545,587,2015-03-09 13:28:02,FALSE,"https://t.co/cnfeso6uCz","http://www.thevideogames.co.uk",,"https://pbs.twimg.com/profile_banners/3081538215/1426176322","http://abs.twimg.com/images/themes/theme1/bg.png","http://pbs.twimg.com/profile_images/574924978941915136/KJSS7_v1_normal.jpeg"
"x948375115","x1331068386831265795",2020-11-24 02:53:28,"TheRealAnthea","@chaseacross Look, I have been wanting to play Werewolf: The Apocalypse lately","Twitter Web App",65,"x1331068197278150657","x41272483","chaseacross",FALSE,FALSE,1,0,,,,,,,,,,,,,,,,"x41272483","chaseacross","en",,,,,,,,,,,,,,,,,,,,,,,,,,,,,,,,,,,,,"NA NA","NA NA","NA NA NA NA NA NA NA NA","https://twitter.com/TheRealAnthea/status/1331068386831265795","Anthea but hygge ☕ ☂️","Seattle, WA","Writes, plays, games; writes plays, games. | Shakespeare, bats, dogs, horror movies, DnD. | She/her 🏳️‍🌈 | Standard social media disclaimer.","https://t.co/72gyLWxHKu",FALSE,344,351,16,12892,40871,2012-11-14 19:43:01,FALSE,"https://t.co/72gyLWxHKu","http://antheacarns.com",,"https://pbs.twimg.com/profile_banners/948375115/1597444451","http://abs.twimg.com/images/themes/theme1/bg.png","http://pbs.twimg.com/profile_images/1328833805679935492/w8ZUlcw3_normal.jpg"
"x987009755473498113","x1331060556686614529",2020-11-24 02:22:21,"CinPickMovies","Similar movies with Piranha 3DD (2012):

    - An American Werewolf in London
    - Piranha 3D
    - Scouts Guide to the Zombie Apocalypse

  More 📽: https://t.co/lDXwD9TlD0

  #similarMovies #movies #findMovies https://t.co/I15RQ4gw0K","Cinpick",211,,,,FALSE,FALSE,0,0,,,"similarMovies movies findMovies",,"cinpick.com/lists/movies-l…","https://t.co/lDXwD9TlD0","https://cinpick.com/lists/movies-like-piranha-3dd","http://pbs.twimg.com/media/EnjghaKXUAAG3nL.jpg","https://t.co/I15RQ4gw0K","https://twitter.com/CinPickMovies/status/1331060556686614529/photo/1","photo","http://pbs.twimg.com/media/EnjghaKXUAAG3nL.jpg","https://t.co/I15RQ4gw0K","https://twitter.com/CinPickMovies/status/1331060556686614529/photo/1",,,,"en",,,,,,,,,,,,,,,,,,,,,,,,,,,,,,,,,,,,,"NA NA","NA NA","NA NA NA NA NA NA NA NA","https://twitter.com/CinPickMovies/status/1331060556686614529","CinPick","","CinPick is a free, innovative, easy to use, community-driven tool for choosing exactly what movie you would like to watch.","https://t.co/LTwsYDHSyT",FALSE,26,46,0,3787,46,2018-04-19 16:47:18,FALSE,"https://t.co/LTwsYDHSyT","http://www.cinpick.com/",,"https://pbs.twimg.com/profile_banners/987009755473498113/1524156784","http://abs.twimg.com/images/themes/theme1/bg.png","http://pbs.twimg.com/profile_images/987010438968807426/2F18ztsf_normal.jpg"
"x3064105708","x1331059635588100096",2020-11-24 02:18:41,"Lordwakkawakka","New werewolf the apocalypse character idea 
Doomer werewolf","Twitter for Android",59,,,,FALSE,FALSE,0,0,,,,,,,,,,,,,,,,,,"en",,,,,,,,,,,,,,,,,,,,,,,,,,,,,,,,,,,,,"NA NA","NA NA","NA NA NA NA NA NA NA NA","https://twitter.com/Lordwakkawakka/status/1331059635588100096","Gwen The Unhinged","Parts Unknown ","|| Gwen || Non binary Trans woman || is probably breaking down right now || She/They || 22 ||",,FALSE,68,774,0,6823,14824,2015-02-26 20:34:38,FALSE,,,,"https://pbs.twimg.com/profile_banners/3064105708/1584833571","http://abs.twimg.com/images/themes/theme1/bg.png","http://pbs.twimg.com/profile_images/1262440928188473349/vnEnLxfF_normal.jpg"
"x1291645374176821248","x1331032155858866177",2020-11-24 00:29:29,"Edwin68301636","Werewolf:The Apocalypse EarthBlood: https://t.co/pcpEivQoi8 #rtItBot #gaming #GamingSetup #gamingcommunity #PS4 #gamingchannel #Youtubegamer 
#gamergirls  #gaminglife #gamingmemes #PS5 #Xbox","Twitter for Android",140,,,,FALSE,TRUE,0,3,,,"rtItBot gaming GamingSetup gamingcommunity PS4",,"youtube.com/playlist?list=…","https://t.co/pcpEivQoi8","https://www.youtube.com/playlist?list=PLI1BA1TeDlWuKbeKnwYLWbrp9xctC16pe&jct=sYhvRQ44EQRwrfGkRslEC3Ftq9QMKA",,,,,,,,,"x1291645374176821248","Edwin68301636","en",,,,,,,,,,,,,,,,"x1313635029629775872","Werewolf:The Apocalypse EarthBlood: https://t.co/pcpEivQoi8 #rtItBot #gaming #GamingSetup #gamingcommunity #PS4 #gamingchannel #Youtubegamer 
#gamergirls  #gaminglife #gamingmemes #PS5 #Xbox",2020-10-07 00:19:31,"Twitter for Android",2,3,"x1291645374176821248","Edwin68301636","True Infinite Gamer",106,147,982,"Queens, NY","Hey Y'all Go Follow My Youtube Game Channel 🎮 & Check out My Playlists to see more. ❤ So Please Go Subscribe, & Leave a Like & Turn on the Notification🛎",FALSE,,,,,,,"NA NA","NA NA","NA NA NA NA NA NA NA NA","https://twitter.com/Edwin68301636/status/1331032155858866177","True Infinite Gamer","Queens, NY","Hey Y'all Go Follow My Youtube Game Channel 🎮 & Check out My Playlists to see more. ❤ So Please Go Subscribe, & Leave a Like & Turn on the Notification🛎","https://t.co/O7N0SUrsFu",FALSE,106,147,1,982,2253,2020-08-07 08:00:55,FALSE,"https://t.co/O7N0SUrsFu","https://www.youtube.com/channel/UCvLPo4HFdDCGtBOX7vTwE-Q",,"https://pbs.twimg.com/profile_banners/1291645374176821248/1601293194",,"http://pbs.twimg.com/profile_images/1305433393656664069/J4w4Uiby_normal.jpg"
"x1070201818196598785","x1330997985568690176",2020-11-23 22:13:43,"synthpoppy","trying to read about the werewolf: the apocalypse werewolves for... no real reason i assure you, and i'm getting some. weird vibes from it. idk","Twitter for Android",143,,,,FALSE,FALSE,0,0,,,,,,,,,,,,,,,,,,"en",,,,,,,,,,,,,,,,,,,,,,,,,,,,,,,,,,,,,"NA NA","NA NA","NA NA NA NA NA NA NA NA","https://twitter.com/synthpoppy/status/1330997985568690176","🌵 poppy @ nanowrimo!","","she/her, they/them ☀️ 23 ☀️ i like gaming (esp ace attorney, ffxiv, and ttrpgs), writing fiction, and furries! ☀️ pfp by @/poodlewool, header by @/1u1us","https://t.co/4sub0Rj7un",FALSE,130,215,0,23903,3510,2018-12-05 06:22:51,FALSE,"https://t.co/4sub0Rj7un","https://synthpoppy.carrd.co",,"https://pbs.twimg.com/profile_banners/1070201818196598785/1606096577","http://abs.twimg.com/images/themes/theme1/bg.png","http://pbs.twimg.com/profile_images/1323432656155992065/ZLSY15pN_normal.jpg"
"x723284262","x1330975589986148359",2020-11-23 20:44:43,"Chaosyn","@sneakermafia2 @fyzzgiggidy I identify as an Ahroun of Get of Fenris. See Werewolf: The Apocalypse, to know more...🤘","Twitter Web App",88,"x1330973276407992323","x328285841","sneakermafia2",FALSE,FALSE,1,0,,,,,,,,,,,,,,,,"x328285841 x1694222593","sneakermafia2 fyzzgiggidy","en",,,,,,,,,,,,,,,,,,,,,,,,,,,,,,,,,,,,,"NA NA","NA NA","NA NA NA NA NA NA NA NA","https://twitter.com/Chaosyn/status/1330975589986148359","Chaos","Pittsburgh, PA","Full time Weirdo and Digital Artist, semi-retired bouncer and  ex-machinist, Chaotic Neutral. Metalhead, gamer, Miniature painter, and a pleasant bastard..maybe",,FALSE,430,248,2,17156,12038,2012-07-29 03:21:18,FALSE,,,,"https://pbs.twimg.com/profile_banners/723284262/1605750688","http://abs.twimg.com/images/themes/theme9/bg.gif","http://pbs.twimg.com/profile_images/1301263334768082949/Wgdfc5Ve_normal.jpg"
"x192928747","x1330970416312164356",2020-11-23 20:24:10,"pdloupee","The lore of Werewolf: the Apocalypse. https://t.co/1SFZZqPriD","Twitter Web App",37,,,,TRUE,FALSE,0,0,,,,,"twitter.com/kaleel_4real/s…","https://t.co/1SFZZqPriD","https://twitter.com/kaleel_4real/status/1330226284400676868",,,,,,,,,,,"en","x1330226284400676868","I like this question 🧐 https://t.co/FfunZg0Axq",2020-11-21 19:07:15,"Twitter for iPhone",1345,79,"x377106880","kaleel_4real","K4R",7035,6169,244094,"In My Skin","Phenix City • SSU Alumnus ✊🏽 • Roll Tide • Inspire & Motivate • Just Keep Watching 📍 @aromasbyarmon #BlackLivesMatter",FALSE,,,,,,,,,,,,,,,,,,,,,,"NA NA","NA NA","NA NA NA NA NA NA NA NA","https://twitter.com/pdloupee/status/1330970416312164356","🎶 🎄 Oh Christmas Loup, oh Christmas Loup..🎄 🎶","pdloupee@gmail.com","Comic Book Editor/Writer. I filter my replies. Neurodivergent. PanRo/Ace/Non-binary. They/She. 🏳️‍🌈 https://t.co/kgvIshMLVt | https://t.co/Dy4grsApdW","https://t.co/TTOUWKwy1e",FALSE,840,294,18,37674,1656,2010-09-20 14:55:36,FALSE,"https://t.co/TTOUWKwy1e","http://behance.net/pdloupee",,"https://pbs.twimg.com/profile_banners/192928747/1591064230","http://abs.twimg.com/images/themes/theme14/bg.gif","http://pbs.twimg.com/profile_images/1322869946267930629/NFpEO-ae_normal.jpg"
"x130407144","x1330944516736512000",2020-11-23 18:41:15,"DesmondFallout","3 facts and 3 tags

-I collected Werewolf The Apocalypse books in HS but never had anyone to play a game
-I read very slow so usually try for audio readings for background noise
-Favorite sandwich is roast beef, swiss, on rye with onion

@Xilimyth 
@MavorTheTurnip 
@Robertge104 https://t.co/tKIKNkUkSy","Twitter Web App",278,,,,TRUE,FALSE,1,0,,,,,"twitter.com/goattrain/stat…","https://t.co/tKIKNkUkSy","https://twitter.com/goattrain/status/1330934410452103168",,,,,,,,,"x126122035 x1248219934376841217 x256515887","Xilimyth MavorTheTurnip Robertge104","en","x1330934410452103168","3 facts and 3 tags

- once raced an elevator on foot and won; got the scar on my eyebrow to prove it
- was drum major in HS marching band, but only because nobody else was qualified
- loves Jesus; is a bit iffy on His fan club

@FelixXanderFox 
@DesmondFallout 
@GiantChinchy https://t.co/PpOhDexcxY",2020-11-23 18:01:05,"Twitter Web App",10,0,"x930086053905608704","goattrain","growtrain",3945,190,55668,"In your closet","goat artist that draws sizey fun and tends to be very flusterable~ - he/his - 31yo - married to best girl @emithegoat - minors get blocked -  ✝💗",FALSE,,,,,,,,,,,,,,,,,,,,,,"NA NA","NA NA","NA NA NA NA NA NA NA NA","https://twitter.com/DesmondFallout/status/1330944516736512000","Desphanie Fallout","Vault 72","I like to write stories and throw money at furries for cartoons of a questionable nature! 😘

Warning: I retweet a lot of art posts and memes.


I do not RP.","https://t.co/hbo3iwOEWa",FALSE,1395,3535,7,17000,42263,2010-04-07 05:57:36,FALSE,"https://t.co/hbo3iwOEWa","https://www.furaffinity.net/user/desmondfallout/",,"https://pbs.twimg.com/profile_banners/130407144/1602809190","http://abs.twimg.com/images/themes/theme1/bg.png","http://pbs.twimg.com/profile_images/1316901212327800833/8gEr3hNA_normal.jpg"
"x1023878705473642498","x1330921447863283713",2020-11-23 17:09:35,"xathrodox86","My final #WorldofDarkness video game review (for some time at least) is up. Travel to eastern Poland and discover the screts of the primeval Białowieża forest in “Werewolf: The Apocalypse – Heart of the Forest”. https://t.co/kGlMiLRxej @TheOnyxPath @differenttales #Steam https://t.co/R7vz7dN3pA","Twitter Web App",271,,,,FALSE,FALSE,3,0,,,"WorldofDarkness Steam",,"italwaysrainsinnuln.wordpress.com/2020/11/23/xat…","https://t.co/kGlMiLRxej","https://italwaysrainsinnuln.wordpress.com/2020/11/23/xathrodox86-reviews-werewolf-the-apocalypse-heart-of-the-forest/","http://pbs.twimg.com/media/EnhhaorXIAQTJeZ.jpg","https://t.co/R7vz7dN3pA","https://twitter.com/xathrodox86/status/1330921447863283713/photo/1","photo","http://pbs.twimg.com/media/EnhhaorXIAQTJeZ.jpg","https://t.co/R7vz7dN3pA","https://twitter.com/xathrodox86/status/1330921447863283713/photo/1",,"x632239134 x1008987010445529090","TheOnyxPath differenttales","en",,,,,,,,,,,,,,,,,,,,,,,,,,,,,,,,,,,,,"NA NA","NA NA","NA NA NA NA NA NA NA NA","https://twitter.com/xathrodox86/status/1330921447863283713","Xathrodox86","Nuln","Sneaky Alpha Legionnaire posing as a noble White Scar. Tabletop enthusiast with a penchant for TTRPGs, Horus Heresy and all things geeky. For Sigmar!","https://t.co/mnTKqcOUCq",FALSE,1014,1211,12,6344,15028,2018-07-30 10:31:20,FALSE,"https://t.co/mnTKqcOUCq","https://italwaysrainsinnuln.wordpress.com/",,"https://pbs.twimg.com/profile_banners/1023878705473642498/1532948684","http://abs.twimg.com/images/themes/theme1/bg.png","http://pbs.twimg.com/profile_images/1023887905947873280/eIdKE42E_normal.jpg"
"x2787028800","x1330844101449830403",2020-11-23 12:02:14,"clairecount","The Wolfenoot Sale has begun! Celebrate and save on Pugmire, Doggos, My Little Pony: Tails of Equestria, Werewolf: the Apocalypse, and more! #TTRPG 
Get 'em here: https://t.co/3vtdQeXvLO https://t.co/o3bj7zpu26","Twitter Web App",140,,,,FALSE,TRUE,0,18,,,,,,,,,,,,,,,,"x18469843","DriveThruRPG","en",,,,,,,,,,,,,,,,"x1329448044010541056","The Wolfenoot Sale has begun! Celebrate and save on Pugmire, Doggos, My Little Pony: Tails of Equestria, Werewolf: the Apocalypse, and more! #TTRPG 
Get 'em here: https://t.co/3vtdQeXvLO https://t.co/o3bj7zpu26",2020-11-19 15:34:48,"Twitter Web App",31,18,"x18469843","DriveThruRPG","DriveThruRPG",24749,847,41161,"","New Releases & more from https://t.co/qE6BWOxZBX. This account is monitored Mon-Fri.",FALSE,,,,,,,"NA NA","NA NA","NA NA NA NA NA NA NA NA","https://twitter.com/clairecount/status/1330844101449830403","Claire Count","Atlanta, GA","#Writer of #scifi & #fantasy suspense when pets allow. #Steampunk fantasy. Gamer & comic lover. Pro-Environment & Liberal. @SistersInCrime","https://t.co/3gNVcvuHZF",FALSE,1184,1811,35,8087,8301,2014-09-03 01:14:37,FALSE,"https://t.co/3gNVcvuHZF","http://www.ClaireCount.com",,"https://pbs.twimg.com/profile_banners/2787028800/1568397187","http://abs.twimg.com/images/themes/theme1/bg.png","http://pbs.twimg.com/profile_images/1044576979268161542/EikHPeof_normal.jpg"
"x71620151","x1330819586476879872",2020-11-23 10:24:49,"hoolegr","@TwitchUKI Finishing up ""Werewolf the apocalypse: heart of the forest"" and then probably play something chill for the rest of the evening (Hades or Binding of Isaac)

Thursday 8pm - https://t.co/GIChyDp7Qu","Twitter for Android",194,"x1330816327192342530","x1268575366219735042","TwitchUKI",FALSE,FALSE,0,0,,,,,"twitch.tv/hoolegr","https://t.co/GIChyDp7Qu","https://twitch.tv/hoolegr",,,,,,,,,"x1268575366219735042","TwitchUKI","en",,,,,,,,,,,,,,,,,,,,,,,,,,,,,,,,,,,,,"NA NA","NA NA","NA NA NA NA NA NA NA NA","https://twitter.com/hoolegr/status/1330819586476879872","Hoolegr","Chesterfield","some people say I'm funny.

https://t.co/IF48Isjkda","https://t.co/PFAuaZUUPr",FALSE,207,158,1,3786,1816,2009-09-04 19:45:17,FALSE,"https://t.co/PFAuaZUUPr","http://www.emberapp.gg",,"https://pbs.twimg.com/profile_banners/71620151/1524058823","http://abs.twimg.com/images/themes/theme14/bg.gif","http://pbs.twimg.com/profile_images/1311580791273664512/LDVqWb7F_normal.jpg"
"x71620151","x1329527015742042113",2020-11-19 20:48:36,"hoolegr","I'm now streaming on Twitch! Playing Werewolf: The Apocalypse - Heart of the Forest https://t.co/WJyxMQp6Hk","IFTTT",107,,,,FALSE,FALSE,0,0,,,,,"ift.tt/2NqYyVt","https://t.co/WJyxMQp6Hk","https://ift.tt/2NqYyVt",,,,,,,,,,,"en",,,,,,,,,,,,,,,,,,,,,,,,,,,,,,,,,,,,,"NA NA","NA NA","NA NA NA NA NA NA NA NA","https://twitter.com/hoolegr/status/1329527015742042113","Hoolegr","Chesterfield","some people say I'm funny.

https://t.co/IF48Isjkda","https://t.co/PFAuaZUUPr",FALSE,207,158,1,3786,1816,2009-09-04 19:45:17,FALSE,"https://t.co/PFAuaZUUPr","http://www.emberapp.gg",,"https://pbs.twimg.com/profile_banners/71620151/1524058823","http://abs.twimg.com/images/themes/theme14/bg.gif","http://pbs.twimg.com/profile_images/1311580791273664512/LDVqWb7F_normal.jpg"
"x257330438","x1330724777586200578",2020-11-23 04:08:05,"troublerumbler","Just saw this on Amazon: Werewolf: The Apocalypse - Earthblood (PS4) - PlayStation 4 by Maximum Games for $59.99 https://t.co/e8Dh9e87PR #deals","Publer ",143,,,,FALSE,FALSE,0,0,,,"deals",,"amzn.to/2FszqOn","https://t.co/e8Dh9e87PR","https://amzn.to/2FszqOn",,,,,,,,,,,"en",,,,,,,,,,,,,,,,,,,,,,,,,,,,,,,,,,,,,"NA NA","NA NA","NA NA NA NA NA NA NA NA","https://twitter.com/troublerumbler/status/1330724777586200578","sinkinkli","","#followback #deals #100フォロバ #フォロバ",,FALSE,153,146,0,36143,15,2011-02-25 05:33:46,FALSE,,,,,"http://abs.twimg.com/images/themes/theme1/bg.png","http://abs.twimg.com/sticky/default_profile_images/default_profile_normal.png"
"x257330438","x1329015609959571456",2020-11-18 10:56:27,"troublerumbler","Werewolf: The Apocalypse - Earthblood (PS4) - PlayStation 4 by Maximum Games for $59.99 https://t.co/e8Dh9e87PR #deals","Publer ",118,,,,FALSE,FALSE,0,0,,,"deals",,"amzn.to/2FszqOn","https://t.co/e8Dh9e87PR","https://amzn.to/2FszqOn",,,,,,,,,,,"en",,,,,,,,,,,,,,,,,,,,,,,,,,,,,,,,,,,,,"NA NA","NA NA","NA NA NA NA NA NA NA NA","https://twitter.com/troublerumbler/status/1329015609959571456","sinkinkli","","#followback #deals #100フォロバ #フォロバ",,FALSE,153,146,0,36143,15,2011-02-25 05:33:46,FALSE,,,,,"http://abs.twimg.com/images/themes/theme1/bg.png","http://abs.twimg.com/sticky/default_profile_images/default_profile_normal.png"
"x22019738","x1330588025684979720",2020-11-22 19:04:41,"samrockweezy","@mattfreedom @Jamesnee @itsmikelike @dantyte For me...Goodfellas, The Shining, Grand Budapest Hotel, Dawn of The Dead, Shaun of the Dead, Big Lebowski, City of God, Saturday Night Fever, Apocalypse Now, Goldfinger, Dr No, Carlito's Way, American Psycho, American Werewolf, Tyrannosaur, Spirited Away, Goonies etc etc etc...","Twitter for Android",278,"x1330429762691608577","x15168144","mattfreedom",FALSE,FALSE,0,0,,,,,,,,,,,,,,,,"x15168144 x16143412 x163044598 x23082616","mattfreedom Jamesnee itsmikelike dantyte","en",,,,,,,,,,,,,,,,,,,,,,,,,,,,,,,,,,,,,"NA NA","NA NA","NA NA NA NA NA NA NA NA","https://twitter.com/samrockweezy/status/1330588025684979720","samroc","Bradford-on-Avon","Bit of Hip Hop, bit of football, bit of boxing and plenty of chatting bollox  #THFC #CCFC #AssociatedMinds",,FALSE,390,532,6,10640,12118,2009-02-26 15:21:01,FALSE,,,,"https://pbs.twimg.com/profile_banners/22019738/1414368998","http://abs.twimg.com/images/themes/theme1/bg.png","http://pbs.twimg.com/profile_images/1038001437358415872/fcIF4JYG_normal.jpg"
"x859796493858942976","x1330585436700422145",2020-11-22 18:54:23,"CoolToysUK","Werewolf: The Apocalypse - Earthblood (Xbox Series X) https://t.co/1Fe9CVlMn3 via @amazon #XboxSeriesX #Xbox","Twitter for iPad",124,,,,FALSE,TRUE,0,3,,,"XboxSeriesX Xbox",,"amzn.to/3kReW0H","https://t.co/1Fe9CVlMn3","https://amzn.to/3kReW0H",,,,,,,,,"x859796493858942976 x20793816","CoolToysUK amazon","en",,,,,,,,,,,,,,,,"x1330459670939635712","Werewolf: The Apocalypse - Earthblood (Xbox Series X) https://t.co/1Fe9CVlMn3 via @amazon #XboxSeriesX #Xbox",2020-11-22 10:34:38,"Twitter for iPad",0,3,"x859796493858942976","CoolToysUK","Cool Toys UK",654,867,24068,"United Kingdom","Photos of cool toys and collectibles found in the UK. Steelbooks/ video games✌️ - By @PhilJones77  | As an Amazon Associate I earn from qualifying purchases  |",FALSE,,,,,,,"NA NA","NA NA","NA NA NA NA NA NA NA NA","https://twitter.com/CoolToysUK/status/1330585436700422145","Cool Toys UK","United Kingdom","Photos of cool toys and collectibles found in the UK. Steelbooks/ video games✌️ - By @PhilJones77  | As an Amazon Associate I earn from qualifying purchases  |","https://t.co/WjTKWFpbkf",FALSE,654,867,3,24068,7048,2017-05-03 15:47:13,FALSE,"https://t.co/WjTKWFpbkf","https://amzn.to/3myKbjo",,"https://pbs.twimg.com/profile_banners/859796493858942976/1496598186",,"http://pbs.twimg.com/profile_images/879491008899272705/TNrLou3__normal.jpg"
"x859796493858942976","x1330459670939635712",2020-11-22 10:34:38,"CoolToysUK","Werewolf: The Apocalypse - Earthblood (Xbox Series X) https://t.co/1Fe9CVlMn3 via @amazon #XboxSeriesX #Xbox","Twitter for iPad",108,,,,FALSE,FALSE,0,3,,,"XboxSeriesX Xbox",,"amzn.to/3kReW0H","https://t.co/1Fe9CVlMn3","https://amzn.to/3kReW0H",,,,,,,,,"x20793816","amazon","en",,,,,,,,,,,,,,,,,,,,,,,,,,,,,,,,,,,,,"NA NA","NA NA","NA NA NA NA NA NA NA NA","https://twitter.com/CoolToysUK/status/1330459670939635712","Cool Toys UK","United Kingdom","Photos of cool toys and collectibles found in the UK. Steelbooks/ video games✌️ - By @PhilJones77  | As an Amazon Associate I earn from qualifying purchases  |","https://t.co/WjTKWFpbkf",FALSE,654,867,3,24068,7048,2017-05-03 15:47:13,FALSE,"https://t.co/WjTKWFpbkf","https://amzn.to/3myKbjo",,"https://pbs.twimg.com/profile_banners/859796493858942976/1496598186",,"http://pbs.twimg.com/profile_images/879491008899272705/TNrLou3__normal.jpg"
"x2154668857","x1330552457836044290",2020-11-22 16:43:21,"JenKollic","(why yes, I have been making Every Werewolf: The Apocalypse Character I Have Ever Created in Heroforge, but mostly just in Homid because of aforementioned lack of huge snarly Crinos options)","Twitter Web App",190,"x1330551848068128772","x2154668857","JenKollic",FALSE,FALSE,1,0,,,,,,,,,,,,,,,,,,"en",,,,,,,,,,,,,,,,,,,,,,,,,,,,,,,,,,,,,"NA NA","NA NA","NA NA NA NA NA NA NA NA","https://twitter.com/JenKollic/status/1330552457836044290","Jen K","Scotland","30+, she/her, Certified Old Fandom Lesbian
I was raised by a cup of coffee.","https://t.co/B2KiDAjLVU",FALSE,46,76,2,5433,3265,2013-10-25 11:05:27,FALSE,"https://t.co/B2KiDAjLVU","http://jen-kollic.tumblr.com/",,"https://pbs.twimg.com/profile_banners/2154668857/1499184670","http://abs.twimg.com/images/themes/theme1/bg.png","http://pbs.twimg.com/profile_images/489144774339743744/lqjhalqk_normal.png"
